{
  "schema_version": "0.1.0",
  "device": {
    "id": "behringer-deepmind-fx",
    "manufacturer": "Behringer",
    "model": "DeepMind effects engine (TC Electronic, Klark Teknik and Midas algorithms)",
    "for_device": ["behringer-deepmind-12d", "behringer-deepmind-12", "behringer-deepmind-6"],
    "sources": [
      {
        "id": "manual",
        "title": "DeepMind 12D User Manual, chapters 7 (FX menu), 9 (Effects Reference Guide) and 16 (MIDI CC)",
        "file": "DeepMind_12D.pdf",
        "kind": "user_manual",
        "note": "Chapter 9 gives one table per algorithm: parameter number, short reference, name, units, min, max, description, and a mark for parameters that are matrix destinations. The 35 tables are parsed mechanically; the prose descriptions in 9.2 are not transcribed."
      }
    ]
  },
  "engine": {
    "slots": 4,
    "algorithm_count": 35,
    "sample_rate_hz": 48000,
    "bit_depth": "24-bit converters, 32/40-bit floating point processing",
    "dsp": "one true-stereo SHARC",
    "bypass": "true hard bypass; the analogue path from the voices to the outputs is preserved when bypassed",
    "modes": ["insert", "send", "bypass"],
    "dynamic_range_db": 114
  },
  "slot_controls": [
    {
      "slot": 1,
      "type_cc": 105,
      "gain_cc": 109,
      "mix": "per slot, on the FX menu",
      "parameter_cc": "62, 63, 65 to 74",
      "note": "Each slot has a TYPE (which algorithm), a MIX (dry to wet) and a LEVEL (output gain). Parameters 1 to 12 of the loaded algorithm map to CCs for slots 1 to 3; slot 4 has type and gain CCs only."
    },
    {
      "slot": 2,
      "type_cc": 106,
      "gain_cc": 110,
      "mix": "per slot, on the FX menu",
      "parameter_cc": "75 to 86",
      "note": "Each slot has a TYPE (which algorithm), a MIX (dry to wet) and a LEVEL (output gain). Parameters 1 to 12 of the loaded algorithm map to CCs for slots 1 to 3; slot 4 has type and gain CCs only."
    },
    {
      "slot": 3,
      "type_cc": 107,
      "gain_cc": 111,
      "mix": "per slot, on the FX menu",
      "parameter_cc": "87 to 95, 102 to 104",
      "note": "Each slot has a TYPE (which algorithm), a MIX (dry to wet) and a LEVEL (output gain). Parameters 1 to 12 of the loaded algorithm map to CCs for slots 1 to 3; slot 4 has type and gain CCs only."
    },
    {
      "slot": 4,
      "type_cc": 108,
      "gain_cc": 112,
      "mix": "per slot, on the FX menu",
      "parameter_cc": "none listed",
      "note": "Each slot has a TYPE (which algorithm), a MIX (dry to wet) and a LEVEL (output gain). Parameters 1 to 12 of the loaded algorithm map to CCs for slots 1 to 3; slot 4 has type and gain CCs only."
    }
  ],
  "routing_modes": [
    {
      "id": "M-1",
      "name": "SERIAL 1-2-3-4",
      "topology": "1 -> 2 -> 3 -> 4"
    },
    {
      "id": "M-2",
      "name": "PARALLEL 1/2 SERIAL 3-4",
      "topology": "(1 || 2) -> 3 -> 4"
    },
    {
      "id": "M-3",
      "name": "PARALLEL 1/2 PARALLEL 3/4",
      "topology": "(1 || 2) -> (3 || 4)"
    },
    {
      "id": "M-4",
      "name": "PARALLEL 1/2/3/4",
      "topology": "1 || 2 || 3 || 4"
    },
    {
      "id": "M-5",
      "name": "PARALLEL 1/2/3 SERIAL 4",
      "topology": "(1 || 2 || 3) -> 4"
    },
    {
      "id": "M-6",
      "name": "SERIAL 1-2 PARALLEL 3/4",
      "topology": "1 -> 2 -> (3 || 4)"
    },
    {
      "id": "M-7",
      "name": "SERIAL 1 PARALLEL 2/3/4",
      "topology": "1 -> (2 || 3 || 4)"
    },
    {
      "id": "M-8",
      "name": "PARALLEL (SERIAL 1-2-3)/4",
      "topology": "(1 -> 2 -> 3) || 4"
    },
    {
      "id": "M-9",
      "name": "SERIAL 3-4 FEEDBACK4(1-2)",
      "topology": "3 -> 4, with 4's output fed back through 1 -> 2",
      "note": "The manual names the mode; the feedback path is read from the name and the routing diagram, not described in words."
    },
    {
      "id": "M-10",
      "name": "SERIAL 4 FEEDBACK4(1-2-3)",
      "topology": "4, with its output fed back through 1 -> 2 -> 3",
      "note": "As M-9."
    }
  ],
  "algorithms": [
    {
      "id": "tc-deepvrb",
      "number": 1,
      "name": "TC-DeepVRB",
      "long_name": "TC DEEP REVERB",
      "type": "reverb",
      "inspiration": "TC Hall of Fame",
      "direct_port": true,
      "parameters": [
        {
          "number": 1,
          "ref": "PST",
          "name": "Preset",
          "units": null,
          "min": null,
          "max": null,
          "mod_destination": false,
          "description": "Options: Ambience, Church, Gate, Hall, Lo Fi, Modulated, Plate, Room, Spring, Tile, Default.",
          "options": [
            "Ambience",
            "Church",
            "Gate",
            "Hall",
            "Lo Fi",
            "Modulated",
            "Plate",
            "Room",
            "Spring",
            "Tile",
            "Default"
          ]
        },
        {
          "number": 2,
          "ref": "DCY",
          "name": "Decay",
          "units": "s",
          "min": 0.1,
          "max": 6.0,
          "mod_destination": true,
          "description": "Controls the amount of time it takes for the reverb to dissipate (range is preset dependant)."
        },
        {
          "number": 3,
          "ref": "TON",
          "name": "Tone",
          "units": "%",
          "min": -50.0,
          "max": 50.0,
          "mod_destination": true,
          "description": "Enhances high frequencies/low frequencies for positive/negative settings respectivly."
        },
        {
          "number": 4,
          "ref": "PDY",
          "name": "PreDelay",
          "units": "ms",
          "min": 0.0,
          "max": 200.0,
          "mod_destination": false,
          "description": "Controls the amount of time before the reverb is heard following the source signal."
        },
        {
          "number": 5,
          "ref": "MIX",
          "name": "Mix",
          "units": "%",
          "min": 0.0,
          "max": 100.0,
          "mod_destination": true,
          "description": "Controls the mix (or ratio) of wet (processed) and dry (unprocessed) signals."
        }
      ]
    },
    {
      "id": "ambverb",
      "number": 2,
      "name": "AmbVerb",
      "long_name": "AMBIENT REVERB",
      "type": "reverb",
      "inspiration": "Lexicon 480L",
      "direct_port": false,
      "parameters": [
        {
          "number": 1,
          "ref": "PD",
          "name": "PreDelay",
          "units": "ms",
          "min": 0.0,
          "max": 200.0,
          "mod_destination": false,
          "description": "Controls the amount of time before the reverb is heard following the source signal."
        },
        {
          "number": 2,
          "ref": "DCY",
          "name": "Decay",
          "units": "s",
          "min": 0.2,
          "max": 7.3,
          "mod_destination": true,
          "description": "Controls the amount of time it takes for the reverb to dissipate."
        },
        {
          "number": 3,
          "ref": "SIZ",
          "name": "Size",
          "units": null,
          "min": 2.0,
          "max": 100.0,
          "mod_destination": false,
          "description": "Controls the perceived size of the space being created by the reverb."
        },
        {
          "number": 4,
          "ref": "DMP",
          "name": "Damping",
          "units": "Hz",
          "min": 1000.0,
          "max": 20000.0,
          "mod_destination": true,
          "description": "Adjusts the decay of the high frequencies within the reverb tail."
        },
        {
          "number": 5,
          "ref": "DIF",
          "name": "Diffusion",
          "units": null,
          "min": 1.0,
          "max": 30.0,
          "mod_destination": false,
          "description": "Controls the initial reflection density."
        },
        {
          "number": 6,
          "ref": "MIX",
          "name": "Mix",
          "units": "%",
          "min": 0.0,
          "max": 100.0,
          "mod_destination": true,
          "description": "Controls the mix (or ratio) of wet (processed) and dry (unprocessed) signals."
        },
        {
          "number": 7,
          "ref": "LC",
          "name": "LoCut",
          "units": "Hz",
          "min": 10.0,
          "max": 500.0,
          "mod_destination": true,
          "description": "Allows the low frequencies affected by the reverb to be reduced."
        },
        {
          "number": 8,
          "ref": "HC",
          "name": "Hi Cut",
          "units": "Hz",
          "min": 200.0,
          "max": 20000.0,
          "mod_destination": true,
          "description": "Allows the high frequencies affected by the reverb to be reduced."
        },
        {
          "number": 9,
          "ref": "MOD",
          "name": "Mod",
          "units": "%",
          "min": 0.0,
          "max": 100.0,
          "mod_destination": false,
          "description": "Controls the reverb tail modulation depth."
        },
        {
          "number": 10,
          "ref": "TGN",
          "name": "TailGain",
          "units": "%",
          "min": 0.0,
          "max": 100.0,
          "mod_destination": true,
          "description": "Adjusts the volume of the reverb tail."
        }
      ]
    },
    {
      "id": "roomrev",
      "number": 3,
      "name": "RoomRev",
      "long_name": "ROOM REVERB",
      "type": "reverb",
      "inspiration": "Lexicon 480L",
      "direct_port": false,
      "parameters": [
        {
          "number": 1,
          "ref": "PRE",
          "name": "PreDelay",
          "units": "ms",
          "min": 0.0,
          "max": 200.0,
          "mod_destination": false,
          "description": "Controls the amount of time before the reverb is heard following the source signal."
        },
        {
          "number": 2,
          "ref": "DCY",
          "name": "Decay",
          "units": "s",
          "min": 0.3,
          "max": 28.9,